{
  "attachment_state": "attached",
  "checkout_id": "cko_00000000000000000000000000",
  "checkout_kind": "main_worktree",
  "content_fingerprint": "sha256:0000000000000000000000000000000000000000000000000000000000000000",
  "default_branch_hint": "fixture",
  "head_commit_id": "fixture",
  "head_ref": "fixture",
  "head_state": "branch",
  "head_tree_id": "fixture",
  "last_observed_at": "2026-01-01T00:00:00Z",
  "limitations": [
    "fixture"
  ],
  "object_format": "fixture",
  "project_id": "prj_00000000000000000000000000",
  "remote_identity": {
    "host": "fixture",
    "owner": "fixture",
    "repository": "fixture"
  },
  "repository_binding_id": "fixture",
  "repository_kind": "git",
  "root_binding_id": "rtb_00000000000000000000000000",
  "schema_id": "star.project-checkout",
  "schema_version": 1,
  "upstream_ref": "fixture",
  "worktree_binding_id": "fixture"
}